{
  "schema": "euclid-min-regular-257-named-new-object-search-report/v1",
  "source": {
    "certificate": "construction-69e.json",
    "certificate_sha256": "9b47738d955099547e15369f35cde40fa52c8c5d7594294d372f1ad753c6b10b",
    "semantic_dependency_report": "semantic-dependencies-69e.json",
    "semantic_dependency_report_sha256": "f515d3f8735f3c33b868fbd7469f2a7d941cf1f3dda586176f9af7079e845ba1",
    "full_intersection_closure_report": "full-intersection-closure-69e.json",
    "full_intersection_closure_report_sha256": "c22dc2fec78d560cfd112de01698506ff94e2ecc372897f2c4243cb5c6f28294"
  },
  "semantics": {
    "point_universe": "the_83_named_points",
    "old_drawable_universe": "the_69_verified_paid_drawables",
    "new_drawables": "one_new_line_or_circle_defined_by_named_points",
    "candidate_pruning": "只保留经过额外具名点的新对象；只经过定义点的对象不能在具名点闭包中产生新点。",
    "limitations": [
      "新对象与旧对象产生的未命名交点尚未纳入本轮搜索。",
      "本轮只加入一个新对象；结论不是所有 68E 构造的不存在性证明。"
    ]
  },
  "enumeration": {
    "named_points": 83,
    "point_pairs": 3403,
    "point_triples": 91881,
    "collinear_triples": 2786,
    "rich_line_geometries": 69,
    "new_rich_line_candidates": 4,
    "new_rich_circle_candidates": 143,
    "circle_radius_pairs": 275643,
    "circle_ball_excluded_pairs": 274718,
    "circle_exact_distance_checks": 925
  },
  "collinearity_filter": {
    "kind": "rigorous_real_ball_determinant",
    "precision_bits": 128,
    "ball_excluded_triples": 18875,
    "exact_collinearity_checks": 73006
  },
  "candidates": [
    {
      "id": "NL0001",
      "kind": "line",
      "canonical_definition": [
        "B",
        "D"
      ],
      "incident_named_points": [
        "B",
        "D",
        "F"
      ],
      "definition_count": 3
    },
    {
      "id": "NL0002",
      "kind": "line",
      "canonical_definition": [
        "D",
        "R"
      ],
      "incident_named_points": [
        "D",
        "R",
        "T"
      ],
      "definition_count": 3
    },
    {
      "id": "NL0003",
      "kind": "line",
      "canonical_definition": [
        "D",
        "S"
      ],
      "incident_named_points": [
        "D",
        "S",
        "V"
      ],
      "definition_count": 3
    },
    {
      "id": "NL0004",
      "kind": "line",
      "canonical_definition": [
        "E",
        "F"
      ],
      "incident_named_points": [
        "E",
        "F",
        "H"
      ],
      "definition_count": 3
    },
    {
      "id": "NC0001",
      "kind": "circle",
      "canonical_definition": [
        "A",
        "G"
      ],
      "center": "A",
      "incident_named_points": [
        "G",
        "F"
      ],
      "definition_count": 2
    },
    {
      "id": "NC0002",
      "kind": "circle",
      "canonical_definition": [
        "A",
        "q_c0_left"
      ],
      "center": "A",
      "incident_named_points": [
        "q_c0_left",
        "q_c0_right"
      ],
      "definition_count": 2
    },
    {
      "id": "NC0003",
      "kind": "circle",
      "canonical_definition": [
        "B",
        "D"
      ],
      "center": "B",
      "incident_named_points": [
        "D",
        "E"
      ],
      "definition_count": 2
    },
    {
      "id": "NC0004",
      "kind": "circle",
      "canonical_definition": [
        "B",
        "G"
      ],
      "center": "B",
      "incident_named_points": [
        "G",
        "F"
      ],
      "definition_count": 2
    },
    {
      "id": "NC0005",
      "kind": "circle",
      "canonical_definition": [
        "B",
        "K"
      ],
      "center": "B",
      "incident_named_points": [
        "K",
        "L"
      ],
      "definition_count": 2
    },
    {
      "id": "NC0006",
      "kind": "circle",
      "canonical_definition": [
        "B",
        "L1"
      ],
      "center": "B",
      "incident_named_points": [
        "L1",
        "N1"
      ],
      "definition_count": 2
    },
    {
      "id": "NC0007",
      "kind": "circle",
      "canonical_definition": [
        "C",
        "D"
      ],
      "center": "C",
      "incident_named_points": [
        "D",
        "E"
      ],
      "definition_count": 2
    },
    {
      "id": "NC0008",
      "kind": "circle",
      "canonical_definition": [
        "C",
        "K"
      ],
      "center": "C",
      "incident_named_points": [
        "K",
        "L"
      ],
      "definition_count": 2
    },
    {
      "id": "NC0009",
      "kind": "circle",
      "canonical_definition": [
        "C",
        "L1"
      ],
      "center": "C",
      "incident_named_points": [
        "L1",
        "N1"
      ],
      "definition_count": 2
    },
    {
      "id": "NC0010",
      "kind": "circle",
      "canonical_definition": [
        "D",
        "B"
      ],
      "center": "D",
      "incident_named_points": [
        "B",
        "C",
        "F"
      ],
      "definition_count": 3
    },
    {
      "id": "NC0011",
      "kind": "circle",
      "canonical_definition": [
        "D",
        "M1"
      ],
      "center": "D",
      "incident_named_points": [
        "M1",
        "G"
      ],
      "definition_count": 2
    },
    {
      "id": "NC0012",
      "kind": "circle",
      "canonical_definition": [
        "E",
        "B"
      ],
      "center": "E",
      "incident_named_points": [
        "B",
        "C",
        "G"
      ],
      "definition_count": 3
    },
    {
      "id": "NC0013",
      "kind": "circle",
      "canonical_definition": [
        "E",
        "M1"
      ],
      "center": "E",
      "incident_named_points": [
        "M1",
        "F"
      ],
      "definition_count": 2
    },
    {
      "id": "NC0014",
      "kind": "circle",
      "canonical_definition": [
        "F",
        "B"
      ],
      "center": "F",
      "incident_named_points": [
        "B",
        "M1"
      ],
      "definition_count": 2
    },
    {
      "id": "NC0015",
      "kind": "circle",
      "canonical_definition": [
        "F",
        "W2_minus"
      ],
      "center": "F",
      "incident_named_points": [
        "W2_minus",
        "W2_plus"
      ],
      "definition_count": 2
    },
    {
      "id": "NC0016",
      "kind": "circle",
      "canonical_definition": [
        "G",
        "B"
      ],
      "center": "G",
      "incident_named_points": [
        "B",
        "M1",
        "H"
      ],
      "definition_count": 3
    },
    {
      "id": "NC0017",
      "kind": "circle",
      "canonical_definition": [
        "G",
        "W2_minus"
      ],
      "center": "G",
      "incident_named_points": [
        "W2_minus",
        "W2_plus"
      ],
      "definition_count": 2
    },
    {
      "id": "NC0018",
      "kind": "circle",
      "canonical_definition": [
        "H1",
        "D"
      ],
      "center": "H1",
      "incident_named_points": [
        "D",
        "E"
      ],
      "definition_count": 2
    },
    {
      "id": "NC0019",
      "kind": "circle",
      "canonical_definition": [
        "H1",
        "G"
      ],
      "center": "H1",
      "incident_named_points": [
        "G",
        "F"
      ],
      "definition_count": 2
    },
    {
      "id": "NC0020",
      "kind": "circle",
      "canonical_definition": [
        "H1",
        "K"
      ],
      "center": "H1",
      "incident_named_points": [
        "K",
        "L"
      ],
      "definition_count": 2
    },
    {
      "id": "NC0021",
      "kind": "circle",
      "canonical_definition": [
        "H1",
        "L1"
      ],
      "center": "H1",
      "incident_named_points": [
        "L1",
        "N1"
      ],
      "definition_count": 2
    },
    {
      "id": "NC0022",
      "kind": "circle",
      "canonical_definition": [
        "H1",
        "q_c0_left"
      ],
      "center": "H1",
      "incident_named_points": [
        "q_c0_left",
        "q_c0_right"
      ],
      "definition_count": 2
    },
    {
      "id": "NC0023",
      "kind": "circle",
      "canonical_definition": [
        "H2",
        "D"
      ],
      "center": "H2",
      "incident_named_points": [
        "D",
        "E"
      ],
      "definition_count": 2
    },
    {
      "id": "NC0024",
      "kind": "circle",
      "canonical_definition": [
        "H2",
        "G"
      ],
      "center": "H2",
      "incident_named_points": [
        "G",
        "F"
      ],
      "definition_count": 2
    },
    {
      "id": "NC0025",
      "kind": "circle",
      "canonical_definition": [
        "H2",
        "K"
      ],
      "center": "H2",
      "incident_named_points": [
        "K",
        "L"
      ],
      "definition_count": 2
    },
    {
      "id": "NC0026",
      "kind": "circle",
      "canonical_definition": [
        "H2",
        "L1"
      ],
      "center": "H2",
      "incident_named_points": [
        "L1",
        "N1"
      ],
      "definition_count": 2
    },
    {
      "id": "NC0027",
      "kind": "circle",
      "canonical_definition": [
        "H2",
        "q_c0_left"
      ],
      "center": "H2",
      "incident_named_points": [
        "q_c0_left",
        "q_c0_right"
      ],
      "definition_count": 2
    },
    {
      "id": "NC0028",
      "kind": "circle",
      "canonical_definition": [
        "I",
        "B"
      ],
      "center": "I",
      "incident_named_points": [
        "B",
        "M1"
      ],
      "definition_count": 2
    },
    {
      "id": "NC0029",
      "kind": "circle",
      "canonical_definition": [
        "I",
        "W2_minus"
      ],
      "center": "I",
      "incident_named_points": [
        "W2_minus",
        "W2_plus"
      ],
      "definition_count": 2
    },
    {
      "id": "NC0030",
      "kind": "circle",
      "canonical_definition": [
        "I1",
        "B"
      ],
      "center": "I1",
      "incident_named_points": [
        "B",
        "M1"
      ],
      "definition_count": 2
    },
    {
      "id": "NC0031",
      "kind": "circle",
      "canonical_definition": [
        "I1",